{
  "schema_version": "0.3.0",
  "artifact_type": "graph_query_result",
  "artifact_id": "graph_query_result_demo_001",
  "run_id": "run_demo_001",
  "iteration": 0,
  "producer": "knowledge_graph",
  "mode": "development",
  "created_at": "2026-10-06T00:03:00Z",
  "status": "completed",
  "input_refs": [],
  "errors": [],
  "runtime_metrics": null,
  "data": {
    "graph_id": "graph_demo_001",
    "graph_revision": 1,
    "results": [
      {"query_id": "query_ownership", "query_key": "resource_ownership", "status": "completed", "rows": [], "errors": []},
      {"query_id": "query_access", "query_key": "role_resource_access", "status": "completed", "rows": [], "errors": []},
      {"query_id": "query_flow", "query_key": "workflow_dependencies", "status": "completed", "rows": [], "errors": []},
      {"query_id": "query_snapshot", "query_key": "structure_snapshot", "status": "completed", "rows": [{"nodes": [], "relationships": [], "workflows": []}], "errors": []}
    ]
  }
}
